pmid,title,abstract,journal,year,authors,full_text,foxf1_mentions,disease_mentions,variant_mentions,variants_found,relevance_score,is_relevant
19020777,Characteristic overexpression of the forkhead box transcription factor Foxf1 in Patched-associated tumors.,"Patients with nevoid basal cell carcinoma syndrome carry germline mutations in the tumor suppressor gene Patched 1 (PTCH1) and are predisposed to develop basal cell carcinoma (BCC), medulloblastoma (MB), and rhabdomyosarcoma (RMS). These tumors are also present in the murine model for Ptch1 deficiency, the Ptch1neo67/+ mouse. Previous studies, including those from our laboratory, have shown that the forkhead box transcription factor Foxf1 is highly expressed in RMS of human and murine origin. We report on a more common role of Foxf1 in Ptch1-associated tumorigenesis, since we found a striking up-regulation of Foxf1 expression in Ptch1-associated BCC and MB compared with the respective non-neoplastic tissue. This overexpression was accompanied by increased levels of the Hedgehog target gene Gli1 as well as the putative Foxf1 targets Bmi1 and Notch2 in these tumors. We also describe a striking Foxf1 activation in Ptch1 null embryos. In contrast, basal expression levels of Foxf1, Gli1, Bmi1 and Notch2 were detected in a variety of adult mouse tissues, such as liver, kidney, spleen, lung, heart and brain. In conclusion, our study suggests that Foxf1 expression is characteristically up-regulated in tumors with a constitutively activated Hedgehog signaling pathway thereby defining a key role for Foxf1 in Hedgehog-associated tumorigenesis.",International journal of molecular medicine,2009,Danielle S Wendling,"Characteristic overexpression of the forkhead box transcription factor Foxf1 in Patched-associated tumors. Patients with nevoid basal cell carcinoma syndrome carry germline mutations in the tumor suppressor gene Patched 1 (PTCH1) and are predisposed to develop basal cell carcinoma (BCC), medulloblastoma (MB), and rhabdomyosarcoma (RMS). These tumors are also present in the murine model for Ptch1 deficiency, the Ptch1neo67/+ mouse. Previous studies, including those from our laboratory, have shown that the forkhead box transcription factor Foxf1 is highly expressed in RMS of human and murine origin. We report on a more common role of Foxf1 in Ptch1-associated tumorigenesis, since we found a striking up-regulation of Foxf1 expression in Ptch1-associated BCC and MB compared with the respective non-neoplastic tissue. This overexpression was accompanied by increased levels of the Hedgehog target gene Gli1 as well as the putative Foxf1 targets Bmi1 and Notch2 in these tumors. We also describe a striking Foxf1 activation in Ptch1 null embryos. In contrast, basal expression levels of Foxf1, Gli1, Bmi1 and Notch2 were detected in a variety of adult mouse tissues, such as liver, kidney, spleen, lung, heart and brain. In conclusion, our study suggests that Foxf1 expression is characteristically up-regulated in tumors with a constitutively activated Hedgehog signaling pathway thereby defining a key role for Foxf1 in Hedgehog-associated tumorigenesis.",1,1,1,,6,True
19049965,FoxF1 and FoxL1 link hedgehog signaling and the control of epithelial proliferation in the developing stomach and intestine.,"The hedgehog (Hh) signaling pathway is a key component of cross-talk during vertebrate gut development, involving endodermally secreted Sonic (Shh) and Indian hedgehog (Ihh) proteins that directly signal to adjacent mesoderm. Here we show that the closely linked mesenchymal forkhead transcription factors Foxf1 and Foxl1 are part of this signaling cascade. Analysis of conserved non-coding sequences surrounding Foxf1 and Foxl1 identified seven Gli binding sites, with two sites near Foxl1 being identical among mammalian, bird, fish, and amphibian species. In vitro experiments indicate that Gli2 binds to these Gli sites, several of which are critical for Gli2-mediated activation of a luciferase reporter in 293 cells. In addition, we demonstrate occupancy of one of these elements by Gli proteins in the intestine in vivo using chromatin immunoprecipitation. Furthermore, expression of both Foxf1 and Foxl1 is reduced in the Gli2/Gli3 mutant gut. These results provide compelling evidence that Foxf1 and Foxl1 are mediators of the Hh (endoderm) to mesoderm signaling pathway.",The Journal of biological chemistry,2009,Blair B Madison,"FoxF1 and FoxL1 link hedgehog signaling and the control of epithelial proliferation in the developing stomach and intestine. The hedgehog (Hh) signaling pathway is a key component of cross-talk during vertebrate gut development, involving endodermally secreted Sonic (Shh) and Indian hedgehog (Ihh) proteins that directly signal to adjacent mesoderm. Here we show that the closely linked mesenchymal forkhead transcription factors Foxf1 and Foxl1 are part of this signaling cascade. Analysis of conserved non-coding sequences surrounding Foxf1 and Foxl1 identified seven Gli binding sites, with two sites near Foxl1 being identical among mammalian, bird, fish, and amphibian species. In vitro experiments indicate that Gli2 binds to these Gli sites, several of which are critical for Gli2-mediated activation of a luciferase reporter in 293 cells. In addition, we demonstrate occupancy of one of these elements by Gli proteins in the intestine in vivo using chromatin immunoprecipitation. Furthermore, expression of both Foxf1 and Foxl1 is reduced in the Gli2/Gli3 mutant gut. These results provide compelling evidence that Foxf1 and Foxl1 are mediators of the Hh (endoderm) to mesoderm signaling pathway.",1,0,0,,3,True
19209716,Interpreting genetics of gene expression: integrative architecture in Bioconductor.,"Several influential studies of genotypic determinants of gene expression in humans have now been published based on various populations including HapMap cohorts. The magnitude of the analytic task (transcriptome vs. SNP-genome) is a hindrance to dissemination of efficient, thorough, and auditable inference methods for this project. We describe the structure and use of Bioconductor facilities for inference in genetics of gene expression, with simultaneous application to multiple HapMap cohorts. Tools distributed for this purpose are readily adapted for the structure and analysis of privately-generated data in expression genetics.",Pacific Symposium on Biocomputing. Pacific Symposium on Biocomputing,2009,V J Carey,"Interpreting genetics of gene expression: integrative architecture in Bioconductor. Several influential studies of genotypic determinants of gene expression in humans have now been published based on various populations including HapMap cohorts. The magnitude of the analytic task (transcriptome vs. SNP-genome) is a hindrance to dissemination of efficient, thorough, and auditable inference methods for this project. We describe the structure and use of Bioconductor facilities for inference in genetics of gene expression, with simultaneous application to multiple HapMap cohorts. Tools distributed for this purpose are readily adapted for the structure and analysis of privately-generated data in expression genetics.",0,0,0,,0,False
19220249,Gene expression of forkhead transcription factors in the normal and diseased human prostate.,"OBJECTIVE To assess the expression of forkhead transcription factors (FOX) in normal prostate and prostate diseases, as since the first FOX was identified, its family members have been implicated in a variety of cellular processes, including embryonic development and disease. MATERIAL AND METHODS We analysed a set of 12 different FOX genes by quantitative reverse transcription-polymerase chain reaction in prostate zones, prostate cancer, lymph node metastases, benign prostatic hyperplasia (BPH), xenografts and several prostate cell lines. RESULTS There were striking differences among the expression of various FOX family members; most prominent were the high expression of FOXF1 and FOXF2 in the normal prostate transition zone and BPH, and their decreased expression in prostate cancer. Interestingly, although the FOXF genes are stroma-specific, some of the androgen-independent prostate cancer xenografts uniquely express these two genes. FOXD1 and FOXD2 were more highly expressed in prostate cancer and lymph node metastases. FOXA1 and FOXC1 have an opposite expression pattern for androgen-dependent growth of prostate cancer cell lines and xenografts. CONCLUSIONS Various members of the FOX family are differentially expressed in the zones of the normal prostate and in benign and malignant outgrowths. The expression profiles of FOXF1 and FOXF2 suggest a role in epithelial to mesenchymal transition, while FOXA1 and FOXC1 expression is linked to androgen-associated growth status of cancer.",BJU international,2009,Leonie van der Heul-Nieuwenhuijsen,"Gene expression of forkhead transcription factors in the normal and diseased human prostate. OBJECTIVE To assess the expression of forkhead transcription factors (FOX) in normal prostate and prostate diseases, as since the first FOX was identified, its family members have been implicated in a variety of cellular processes, including embryonic development and disease. MATERIAL AND METHODS We analysed a set of 12 different FOX genes by quantitative reverse transcription-polymerase chain reaction in prostate zones, prostate cancer, lymph node metastases, benign prostatic hyperplasia (BPH), xenografts and several prostate cell lines. RESULTS There were striking differences among the expression of various FOX family members; most prominent were the high expression of FOXF1 and FOXF2 in the normal prostate transition zone and BPH, and their decreased expression in prostate cancer. Interestingly, although the FOXF genes are stroma-specific, some of the androgen-independent prostate cancer xenografts uniquely express these two genes. FOXD1 and FOXD2 were more highly expressed in prostate cancer and lymph node metastases. FOXA1 and FOXC1 have an opposite expression pattern for androgen-dependent growth of prostate cancer cell lines and xenografts. CONCLUSIONS Various members of the FOX family are differentially expressed in the zones of the normal prostate and in benign and malignant outgrowths. The expression profiles of FOXF1 and FOXF2 suggest a role in epithelial to mesenchymal transition, while FOXA1 and FOXC1 expression is linked to androgen-associated growth status of cancer.",2,1,0,,7,True
19244248,On the role of FOX transcription factors in adipocyte differentiation and insulin-stimulated glucose uptake.,"In this study, we explore the effects of several FOX and mutant FOX transcription factors on adipocyte determination, differentiation, and metabolism. In addition to Foxc2 and Foxo1, we report that Foxf2, Foxp1, and Foxa1 are other members of the Fox family that show regulated expression during adipogenesis. Although enforced expression of FOXC2 inhibits adipogenesis, Foxf2 slightly enhances the rate of differentiation. Constitutively active FOXC2-VP16 inhibits adipogenesis through multiple mechanisms. FOXC2-VP16 impairs the transient induction of C/EBPbeta during adipogenesis and induces expression of the transcriptional repressor Hey1 as well as the activator of Wnt/beta-catenin signaling, Wnt10b. The constitutive transcriptional repressor, FOXC2-Eng, enhances adipogenesis of preadipocytes and multipotent mesenchymal precursors and determines NIH-3T3 and C2C12 cells to the adipocyte lineage. Although PPARgamma ligand or C/EBPalpha are not necessary for stimulation of adipogenesis by FOXC2-Eng, at least low levels of PPARgamma protein are absolutely required. Finally, expression of FOXC2-Eng in adipocytes increases insulin-stimulated glucose uptake, further expanding the profound and pleiotropic effects of FOX transcription factors on adipocyte biology.",The Journal of biological chemistry,2009,Isabelle Gerin,"On the role of FOX transcription factors in adipocyte differentiation and insulin-stimulated glucose uptake. In this study, we explore the effects of several FOX and mutant FOX transcription factors on adipocyte determination, differentiation, and metabolism. In addition to Foxc2 and Foxo1, we report that Foxf2, Foxp1, and Foxa1 are other members of the Fox family that show regulated expression during adipogenesis. Although enforced expression of FOXC2 inhibits adipogenesis, Foxf2 slightly enhances the rate of differentiation. Constitutively active FOXC2-VP16 inhibits adipogenesis through multiple mechanisms. FOXC2-VP16 impairs the transient induction of C/EBPbeta during adipogenesis and induces expression of the transcriptional repressor Hey1 as well as the activator of Wnt/beta-catenin signaling, Wnt10b. The constitutive transcriptional repressor, FOXC2-Eng, enhances adipogenesis of preadipocytes and multipotent mesenchymal precursors and determines NIH-3T3 and C2C12 cells to the adipocyte lineage. Although PPARgamma ligand or C/EBPalpha are not necessary for stimulation of adipogenesis by FOXC2-Eng, at least low levels of PPARgamma protein are absolutely required. Finally, expression of FOXC2-Eng in adipocytes increases insulin-stimulated glucose uptake, further expanding the profound and pleiotropic effects of FOX transcription factors on adipocyte biology.",1,0,0,,3,True
19276632,Mutation analysis of FOXF2 in patients with disorders of sex development (DSD) in combination with cleft palate.,"In contrast to disorders of sexual differentiation caused by lack of androgen production or inhibited androgen action, defects affecting development of the bipotent genital anlagen have rarely been investigated in humans. We have previously documented that the transcription factor FOXF2 is highly expressed in human foreskin. Moreover, Foxf2 knockout mice present with cleft palate in combination with hypoplasia of the genital tubercle. We hypothesized that humans with disorders of sex development (DSD) in combination with cleft palate could have mutations in the FOXF2 gene. Eighteen children with DSD and cleft palate were identified in the L&#xfc;beck DSD database (about 1,500 entries). Genomic DNA sequence analysis of the FOXF2 gene was performed and compared with 10 normal female and 10 normal male controls, respectively. Two heterozygous DNA sequence variations were solely present in one single patient each but in none of the 20 normal controls: a duplication of GCC (c.97GCC[9]+[10]) resulting in an extra alanine within exon 1 and a 25*G&gt;A substitution in the 3'-untranslated region. Two patients carried a c.262G&gt;A sequence variation predicting for an Ala88Thr exchange which was also detected in 2 normal controls. Two silent mutations, c.1272C&gt;T (Ser424Ser) and c.1284T&gt;C (Tyr428Tyr), respectively, occurred in the coding region of exon 2, again in both patients and normal controls. In conclusion, the majority of the detected sequence alterations were polymorphisms without obvious functional relevance. However, it cannot be excluded that the 2 unique DNA sequence alterations could have affected FOXF2 on the mRNA or protein level thus contributing to the observed disturbances in genital and palate development.","Sexual development : genetics, molecular biology, evolution, endocrinology, embryology, and pathology of sex determination and differentiation",2009,U Jochumsen,"Mutation analysis of FOXF2 in patients with disorders of sex development (DSD) in combination with cleft palate. In contrast to disorders of sexual differentiation caused by lack of androgen production or inhibited androgen action, defects affecting development of the bipotent genital anlagen have rarely been investigated in humans. We have previously documented that the transcription factor FOXF2 is highly expressed in human foreskin. Moreover, Foxf2 knockout mice present with cleft palate in combination with hypoplasia of the genital tubercle. We hypothesized that humans with disorders of sex development (DSD) in combination with cleft palate could have mutations in the FOXF2 gene. Eighteen children with DSD and cleft palate were identified in the L&#xfc;beck DSD database (about 1,500 entries). Genomic DNA sequence analysis of the FOXF2 gene was performed and compared with 10 normal female and 10 normal male controls, respectively. Two heterozygous DNA sequence variations were solely present in one single patient each but in none of the 20 normal controls: a duplication of GCC (c.97GCC[9]+[10]) resulting in an extra alanine within exon 1 and a 25*G&gt;A substitution in the 3'-untranslated region. Two patients carried a c.262G&gt;A sequence variation predicting for an Ala88Thr exchange which was also detected in 2 normal controls. Two silent mutations, c.1272C&gt;T (Ser424Ser) and c.1284T&gt;C (Tyr428Tyr), respectively, occurred in the coding region of exon 2, again in both patients and normal controls. In conclusion, the majority of the detected sequence alterations were polymorphisms without obvious functional relevance. However, it cannot be excluded that the 2 unique DNA sequence alterations could have affected FOXF2 on the mRNA or protein level thus contributing to the observed disturbances in genital and palate development.",1,1,2,,8,True
19360354,"Transcriptional regulation of WNT2B based on the balance of Hedgehog, Notch, BMP and WNT signals.","We cloned and characterized human WNT2B in 1996, and then others cloned and characterized mouse, chicken, and zebrafish WNT2B orthologs. WNT2B is expressed in several types of human cancer, such as basal cell carcinoma, gastric cancer, breast cancer, head/neck squamous cell carcinoma, cervical cancer and leukemia. WNT2B is one of canonical WNTs transducing signals through Frizzled (FZD) and LRP5/LRP6 receptors to beta-catenin-TCF/LEF signaling cascade. Here, refined integrative genomic analyses on WNT2B orthologs were carried out to elucidate its transcriptional mechanisms. GLI-, double FOX-, HES/HEY-, bHLH-, and Sp1-binding sites within mammalian WNT2B promoter were well conserved. Because GLI1, FOXA2, FOXC2, FOXE1, FOXF1 and FOXL1 are direct target genes of Hedgehog-GLI2 signaling cascade, Hedgehog signals should induce WNT2B upregulation through GLI family members as well as FOX family members. Notch, BMP and Hedgehog signals inhibit WNT2B expression via HES/HEY-binding to N-box, whereas BMP and WNT signals inhibit bHLH transcription factor-induced WNT2B expression via ID1, ID2, ID3, MSX1 or MSX2. Together these facts indicate that Hedgehog signals and bHLH transcription factors are involved in WNT2B upregulation, which is counteracted by BMP, WNT and Notch signals. Mesenchymal BMP induces IHH expression in gastrointestinal epithelial cells, and then epithelial Hedgehog induces WNT2B and BMP4 expression in mesenchymal cells. NF-kappaB signals induce SHH upregulation, and WNT2B is upregulated in inflammatory bowel disease (IBD). BMP-IHH and inflammation-SHH signaling loops are involved in WNT2B up-regulation during embryogenesis, adult tissue homeostasis, and carcinogenesis.",International journal of oncology,2009,Masuko Katoh,"Transcriptional regulation of WNT2B based on the balance of Hedgehog, Notch, BMP and WNT signals. We cloned and characterized human WNT2B in 1996, and then others cloned and characterized mouse, chicken, and zebrafish WNT2B orthologs. WNT2B is expressed in several types of human cancer, such as basal cell carcinoma, gastric cancer, breast cancer, head/neck squamous cell carcinoma, cervical cancer and leukemia. WNT2B is one of canonical WNTs transducing signals through Frizzled (FZD) and LRP5/LRP6 receptors to beta-catenin-TCF/LEF signaling cascade. Here, refined integrative genomic analyses on WNT2B orthologs were carried out to elucidate its transcriptional mechanisms. GLI-, double FOX-, HES/HEY-, bHLH-, and Sp1-binding sites within mammalian WNT2B promoter were well conserved. Because GLI1, FOXA2, FOXC2, FOXE1, FOXF1 and FOXL1 are direct target genes of Hedgehog-GLI2 signaling cascade, Hedgehog signals should induce WNT2B upregulation through GLI family members as well as FOX family members. Notch, BMP and Hedgehog signals inhibit WNT2B expression via HES/HEY-binding to N-box, whereas BMP and WNT signals inhibit bHLH transcription factor-induced WNT2B expression via ID1, ID2, ID3, MSX1 or MSX2. Together these facts indicate that Hedgehog signals and bHLH transcription factors are involved in WNT2B upregulation, which is counteracted by BMP, WNT and Notch signals. Mesenchymal BMP induces IHH expression in gastrointestinal epithelial cells, and then epithelial Hedgehog induces WNT2B and BMP4 expression in mesenchymal cells. NF-kappaB signals induce SHH upregulation, and WNT2B is upregulated in inflammatory bowel disease (IBD). BMP-IHH and inflammation-SHH signaling loops are involved in WNT2B up-regulation during embryogenesis, adult tissue homeostasis, and carcinogenesis.",1,1,0,,4,True
19424602,"Transcriptional mechanisms of WNT5A based on NF-kappaB, Hedgehog, TGFbeta, and Notch signaling cascades.","WNT5A is a cancer-associated gene involved in invasion and metastasis of melanoma, breast cancer, pancreatic cancer, and gastric cancer. WNT5A transduces signals through Frizzled, ROR1, ROR2 or RYK receptors to beta-catenin-TCF/LEF, DVL-RhoA-ROCK, DVL-RhoB-Rab4, DVL-Rac-JNK, DVL-aPKC, Calcineurin-NFAT, MAP3K7-NLK, MAP3K7-NF-kappaB, and DAG-PKC signaling cascades in a context-dependent manner. SNAI1 (Snail), CD44, G3BP2, and YAP1 are WNT5A target genes. We and other groups previously reported that IL6- or LIF-induced signaling through JAK-STAT3 signaling cascade is involved in WNT5A upregulation (STAT3-WNT5A signaling loop). Here, refined integrative genomic analyses of WNT5A were carried out to elucidate other mechanisms of WNT5A transcription. The WNT5A gene was found to encode two isoforms by using alternative first exons 1A and 1B. Quadruple Smad-binding elements (SBEs), single Sp1-binding site (GC-box), PPARgamma-binding site, C/EBP-binding site and bHLH-binding site within the promoter A region, 5'-adjacent to exon 1A, were conserved in human WNT5A, chimpanzee WNT5A, mouse Wnt5a, and rat Wnt5a. NF-kappaB-binding site, CUX1-binding site, double SBEs and double GC-boxes within the promoter B region, 5'-adjacent to exon 1B, were conserved in mammalian WNT5A orthologs. Quadruple FOX-binding sites and double SBEs within ultra-conserved intron 1 were also conserved in mammalian WNT5A orthologs. Conserved NF-kappaB-binding site within the WNT5A promoter B region elucidated the mechanisms that TNFalpha and toll-like receptor (TLR) signals upregulate WNT5A via MAP3K7. Quadruple FOX-binding sites rather than GLI-binding site revealed that Hedgehog signals induce WNT5A upregulation indirectly via FOX family members, such as FOXA2, FOXC2, FOXE1, FOXF1 and FOXL1. TGFbeta signals were found to upregulate WNT5A expression directly through the Smad complex, and also indirectly through Smad-induced CUX1 and MAP3K7-mediated NF-kappaB. Together these facts indicate that WNT5A is transcribed based on multiple mechanisms, such as NF-kappaB, Hedgehog, TGFbeta, and Notch signaling cascades.",International journal of molecular medicine,2009,Masuko Katoh,"Transcriptional mechanisms of WNT5A based on NF-kappaB, Hedgehog, TGFbeta, and Notch signaling cascades. WNT5A is a cancer-associated gene involved in invasion and metastasis of melanoma, breast cancer, pancreatic cancer, and gastric cancer. WNT5A transduces signals through Frizzled, ROR1, ROR2 or RYK receptors to beta-catenin-TCF/LEF, DVL-RhoA-ROCK, DVL-RhoB-Rab4, DVL-Rac-JNK, DVL-aPKC, Calcineurin-NFAT, MAP3K7-NLK, MAP3K7-NF-kappaB, and DAG-PKC signaling cascades in a context-dependent manner. SNAI1 (Snail), CD44, G3BP2, and YAP1 are WNT5A target genes. We and other groups previously reported that IL6- or LIF-induced signaling through JAK-STAT3 signaling cascade is involved in WNT5A upregulation (STAT3-WNT5A signaling loop). Here, refined integrative genomic analyses of WNT5A were carried out to elucidate other mechanisms of WNT5A transcription. The WNT5A gene was found to encode two isoforms by using alternative first exons 1A and 1B. Quadruple Smad-binding elements (SBEs), single Sp1-binding site (GC-box), PPARgamma-binding site, C/EBP-binding site and bHLH-binding site within the promoter A region, 5'-adjacent to exon 1A, were conserved in human WNT5A, chimpanzee WNT5A, mouse Wnt5a, and rat Wnt5a. NF-kappaB-binding site, CUX1-binding site, double SBEs and double GC-boxes within the promoter B region, 5'-adjacent to exon 1B, were conserved in mammalian WNT5A orthologs. Quadruple FOX-binding sites and double SBEs within ultra-conserved intron 1 were also conserved in mammalian WNT5A orthologs. Conserved NF-kappaB-binding site within the WNT5A promoter B region elucidated the mechanisms that TNFalpha and toll-like receptor (TLR) signals upregulate WNT5A via MAP3K7. Quadruple FOX-binding sites rather than GLI-binding site revealed that Hedgehog signals induce WNT5A upregulation indirectly via FOX family members, such as FOXA2, FOXC2, FOXE1, FOXF1 and FOXL1. TGFbeta signals were found to upregulate WNT5A expression directly through the Smad complex, and also indirectly through Smad-induced CUX1 and MAP3K7-mediated NF-kappaB. Together these facts indicate that WNT5A is transcribed based on multiple mechanisms, such as NF-kappaB, Hedgehog, TGFbeta, and Notch signaling cascades.",1,0,0,,3,True
