pmid,title,abstract,journal,year,authors,full_text,foxf1_mentions,disease_mentions,variant_mentions,variants_found,relevance_score,is_relevant
17237346,Transcriptional control of lung morphogenesis.,"The vertebrate lung consists of multiple cell types that are derived primarily from endodermal and mesodermal compartments of the early embryo. The process of pulmonary organogenesis requires the generation of precise signaling centers that are linked to transcriptional programs that, in turn, regulate cell numbers, differentiation, and behavior, as branching morphogenesis and alveolarization proceed. This review summarizes knowledge regarding the expression and proposed roles of transcription factors influencing lung formation and function with particular focus on knowledge derived from the study of the mouse. A group of transcription factors active in the endodermally derived cells of the developing lung tubules, including thyroid transcription factor-1 (TTF-1), beta-catenin, Forkhead orthologs (FOX), GATA, SOX, and ETS family members are required for normal lung morphogenesis and function. In contrast, a group of distinct proteins, including FOXF1, POD1, GLI, and HOX family members, play important roles in the developing lung mesenchyme, from which pulmonary vessels and bronchial smooth muscle develop. Lung formation is dependent on reciprocal signaling among cells of both endodermal and mesenchymal compartments that instruct transcriptional processes mediating lung formation and adaptation to breathing after birth.",Physiological reviews,2007,Yutaka Maeda,"Transcriptional control of lung morphogenesis. The vertebrate lung consists of multiple cell types that are derived primarily from endodermal and mesodermal compartments of the early embryo. The process of pulmonary organogenesis requires the generation of precise signaling centers that are linked to transcriptional programs that, in turn, regulate cell numbers, differentiation, and behavior, as branching morphogenesis and alveolarization proceed. This review summarizes knowledge regarding the expression and proposed roles of transcription factors influencing lung formation and function with particular focus on knowledge derived from the study of the mouse. A group of transcription factors active in the endodermally derived cells of the developing lung tubules, including thyroid transcription factor-1 (TTF-1), beta-catenin, Forkhead orthologs (FOX), GATA, SOX, and ETS family members are required for normal lung morphogenesis and function. In contrast, a group of distinct proteins, including FOXF1, POD1, GLI, and HOX family members, play important roles in the developing lung mesenchyme, from which pulmonary vessels and bronchial smooth muscle develop. Lung formation is dependent on reciprocal signaling among cells of both endodermal and mesenchymal compartments that instruct transcriptional processes mediating lung formation and adaptation to breathing after birth.",2,0,0,,6,True
17261592,Forkhead box F1 is essential for migration of mesenchymal cells and directly induces integrin-beta3 expression.,"The Forkhead box f1 (Foxf1) transcription factor is expressed in mesenchymal cells of the lung, liver, and gallbladder. Although Foxf1 deficiency causes severe abnormalities in the development of these organs, the molecular mechanisms underlying Foxf1 function remain uncharacterized. In this study we inactivated Foxf1 function in lung mesenchymal cells and mouse embryonic fibroblasts (MEFs) by use of either short interfering RNA duplexes or a membrane-transducing Foxf1 dominant negative (DN) mutant protein (Foxf1 DN), the latter of which is fused to the human immunodeficiency virus TAT protein transduction domain. Although Foxf1 did not influence DNA replication or cell survival, Foxf1 depletion severely diminished mesenchyme migration. Foxf1 deficiency in mesenchymal cells was associated with reduced expression of the integrin-beta3 (Itgbeta3) subunit. Furthermore, we generated transgenic mice containing a tetracycline-inducible Foxf1 DN transgene. Adenovirus-mediated activation of Foxf1 DN in transgenic MEFs caused diminished cell migration and reduced Itgbeta3 expression. A chromatin immunoprecipitation assay demonstrated that Foxf1 protein binds to the bp -871 to -815 region of the mouse Itgbeta3 promoter. Deletion of the -871 to -815 Itgbeta3 promoter region completely abolished the ability of Foxf1 to activate transcription of the Itgbeta3 promoter in cotransfection experiments, indicating that the mouse Itgbeta3 is a direct transcriptional target of Foxf1 protein. Foxf1 plays an essential role in mesenchyme migration by transcriptionally regulating Itgbeta3.",Molecular and cellular biology,2007,Dmitriy Malin,"Forkhead box F1 is essential for migration of mesenchymal cells and directly induces integrin-beta3 expression. The Forkhead box f1 (Foxf1) transcription factor is expressed in mesenchymal cells of the lung, liver, and gallbladder. Although Foxf1 deficiency causes severe abnormalities in the development of these organs, the molecular mechanisms underlying Foxf1 function remain uncharacterized. In this study we inactivated Foxf1 function in lung mesenchymal cells and mouse embryonic fibroblasts (MEFs) by use of either short interfering RNA duplexes or a membrane-transducing Foxf1 dominant negative (DN) mutant protein (Foxf1 DN), the latter of which is fused to the human immunodeficiency virus TAT protein transduction domain. Although Foxf1 did not influence DNA replication or cell survival, Foxf1 depletion severely diminished mesenchyme migration. Foxf1 deficiency in mesenchymal cells was associated with reduced expression of the integrin-beta3 (Itgbeta3) subunit. Furthermore, we generated transgenic mice containing a tetracycline-inducible Foxf1 DN transgene. Adenovirus-mediated activation of Foxf1 DN in transgenic MEFs caused diminished cell migration and reduced Itgbeta3 expression. A chromatin immunoprecipitation assay demonstrated that Foxf1 protein binds to the bp -871 to -815 region of the mouse Itgbeta3 promoter. Deletion of the -871 to -815 Itgbeta3 promoter region completely abolished the ability of Foxf1 to activate transcription of the Itgbeta3 promoter in cotransfection experiments, indicating that the mouse Itgbeta3 is a direct transcriptional target of Foxf1 protein. Foxf1 plays an essential role in mesenchyme migration by transcriptionally regulating Itgbeta3.",2,0,1,,8,True
17471488,Global gene expression profiling of PAX-FKHR fusion-positive alveolar and PAX-FKHR fusion-negative embryonal rhabdomyosarcomas.,"Paediatric rhabdomyosarcomas (RMS) are classified into two major subtypes based on histological appearance, embryonal (ERMS) and alveolar (ARMS), but this clinically critical distinction is often difficult on morphological grounds alone. ARMS, the more aggressive subtype, is associated in most cases with unique recurrent translocations fusing the PAX3 or PAX7 transcription factor genes to FKHR. In contrast, ERMS lacks unique genetic alterations. To identify novel diagnostic markers and potential therapeutic targets, we analysed the global gene expression profiles of these two RMS subtypes in 23 ARMS (16 PAX3-FKHR, 7 PAX7-FKHR) and 15 ERMS (all PAX-FKHR-negative) using Affymetrix HG-U133A oligonucleotide arrays. A statistically stringent supervised comparison of the ARMS and ERMS expression profiles revealed 121 genes that were significantly differentially expressed, of which 112 were higher in ARMS, including genes of interest as potential diagnostic markers or therapeutic targets, such as CNR1, PIPOX (sarcosine oxidase), and TFAPbeta. Interestingly, many known or putative downstream targets of PAX3-FKHR were highly overexpressed in ARMS relative to ERMS, including CNR1, DCX, ABAT, ASS, JAKMIP2, DKFZp762M127, and NRCAM. We validated the highly differential expression of five genes, including CNR1, DKFZp762M127, DCX, PIPOX, and FOXF1 in ARMS relative to ERMS by quantitative RT-PCR on an independent set of samples. Finally, we developed a ten-gene microarray-based predictor that distinguished ARMS from ERMS with approximately 95% accuracy both in our data by cross-validation and in an independent validation using a published dataset of 26 samples. The gene expression signature of ARMS provides a source of potential diagnostic markers, therapeutic targets, and PAX-FKHR downstream genes, and can be used to reliably distinguish these sarcomas from ERMS.",The Journal of pathology,2007,M La&#xe9;,"Global gene expression profiling of PAX-FKHR fusion-positive alveolar and PAX-FKHR fusion-negative embryonal rhabdomyosarcomas. Paediatric rhabdomyosarcomas (RMS) are classified into two major subtypes based on histological appearance, embryonal (ERMS) and alveolar (ARMS), but this clinically critical distinction is often difficult on morphological grounds alone. ARMS, the more aggressive subtype, is associated in most cases with unique recurrent translocations fusing the PAX3 or PAX7 transcription factor genes to FKHR. In contrast, ERMS lacks unique genetic alterations. To identify novel diagnostic markers and potential therapeutic targets, we analysed the global gene expression profiles of these two RMS subtypes in 23 ARMS (16 PAX3-FKHR, 7 PAX7-FKHR) and 15 ERMS (all PAX-FKHR-negative) using Affymetrix HG-U133A oligonucleotide arrays. A statistically stringent supervised comparison of the ARMS and ERMS expression profiles revealed 121 genes that were significantly differentially expressed, of which 112 were higher in ARMS, including genes of interest as potential diagnostic markers or therapeutic targets, such as CNR1, PIPOX (sarcosine oxidase), and TFAPbeta. Interestingly, many known or putative downstream targets of PAX3-FKHR were highly overexpressed in ARMS relative to ERMS, including CNR1, DCX, ABAT, ASS, JAKMIP2, DKFZp762M127, and NRCAM. We validated the highly differential expression of five genes, including CNR1, DKFZp762M127, DCX, PIPOX, and FOXF1 in ARMS relative to ERMS by quantitative RT-PCR on an independent set of samples. Finally, we developed a ten-gene microarray-based predictor that distinguished ARMS from ERMS with approximately 95% accuracy both in our data by cross-validation and in an independent validation using a published dataset of 26 samples. The gene expression signature of ARMS provides a source of potential diagnostic markers, therapeutic targets, and PAX-FKHR downstream genes, and can be used to reliably distinguish these sarcomas from ERMS.",1,0,0,,3,True
17962963,Visualizing expression patterns of Shh and Foxf1 genes in the foregut and lung buds by optical projection tomography.,"Congenital malformations of the foregut are common in humans. The respiratory and digestive tubes are both derived by division of the foregut primordium. Sonic hedgehog (Shh) and Fork head box F1 (Foxf1) genes encode regulatory molecules that play a pivotal role in gut and lung morphogenesis and are therefore important candidate genes to be examined in models of foregut developmental disruption. Optical projection tomography (OPT) is a new, rapid and non-invasive technique for three-dimensional (3D) imaging of small biological tissue specimens that allows visualization of the tissue distribution of RNA in developing organs while also recording morphology. To explore the application of OPT in this context, we visualized Shh and Foxf1 gene expression patterns in the mouse foregut and lung buds at several stages of development. Time-mated CBA/Ca mice were harvested on embryonic days 9-12. The embryos were stained following whole mount in situ hybridization with labelled RNA probes to detect Shh and Foxf1 transcripts at each stage. The embryos were scanned by OPT to obtain 3D representations of gene expression domains in the context of the changing morphology of the embryo. OPT analysis of Shh and Foxf1 expression in the foregut and lung buds revealed extra details of the patterns not previously reported, particularly in the case of Foxf1 where gene expression was revealed in a changing pattern in the mesenchyme around the developing lung. Shh expression was also revealed in the epithelium of the lung bud itself. Both genes were detected in complementary patterns in the developing bronchi as late as E12, showing successful penetration of molecular probes and imaging at later stages. OPT is a valuable tool for revealing gene expression in an anatomical context even in internal tissues like the foregut and lung buds across stages of development, at least until E12. This provides the possibility of visualizing altered gene expression in an in vivo context in genetic or teratogenic models of congenital malformations.",Pediatric surgery international,2008,Hideaki Sato,"Visualizing expression patterns of Shh and Foxf1 genes in the foregut and lung buds by optical projection tomography. Congenital malformations of the foregut are common in humans. The respiratory and digestive tubes are both derived by division of the foregut primordium. Sonic hedgehog (Shh) and Fork head box F1 (Foxf1) genes encode regulatory molecules that play a pivotal role in gut and lung morphogenesis and are therefore important candidate genes to be examined in models of foregut developmental disruption. Optical projection tomography (OPT) is a new, rapid and non-invasive technique for three-dimensional (3D) imaging of small biological tissue specimens that allows visualization of the tissue distribution of RNA in developing organs while also recording morphology. To explore the application of OPT in this context, we visualized Shh and Foxf1 gene expression patterns in the mouse foregut and lung buds at several stages of development. Time-mated CBA/Ca mice were harvested on embryonic days 9-12. The embryos were stained following whole mount in situ hybridization with labelled RNA probes to detect Shh and Foxf1 transcripts at each stage. The embryos were scanned by OPT to obtain 3D representations of gene expression domains in the context of the changing morphology of the embryo. OPT analysis of Shh and Foxf1 expression in the foregut and lung buds revealed extra details of the patterns not previously reported, particularly in the case of Foxf1 where gene expression was revealed in a changing pattern in the mesenchyme around the developing lung. Shh expression was also revealed in the epithelium of the lung bud itself. Both genes were detected in complementary patterns in the developing bronchi as late as E12, showing successful penetration of molecular probes and imaging at later stages. OPT is a valuable tool for revealing gene expression in an anatomical context even in internal tissues like the foregut and lung buds across stages of development, at least until E12. This provides the possibility of visualizing altered gene expression in an in vivo context in genetic or teratogenic models of congenital malformations.",1,1,0,,4,True
18202312,Forkhead transcription factors coordinate expression of myocardial KATP channel subunits and energy metabolism.,"Coordinate adaptation of myocyte metabolism and function is fundamental to survival of the stressed heart, but the mechanisms for this coordination remain unclear. Bioinformatics led us to discover that Foxs are key transcription factors involved. We performed experiments on the mouse atrial cell line HL-1, neonate rat heart myocytes, and an adult rat model of myocardial infarction. In electrophoretic mobility-shift assays, FoxO1 binds to the FoxO concensus site of the KATP channel subunit KIR6.1 promoter. In primary atrial culture, targeting FoxO1 and FoxO3 with siRNA specifically reduces mRNA expression of FoxO1 and -O3 and KIR6.1. Western blots, confocal immunofluorescence, and quantitative RT-PCR was applied for measuring expression of 10 Fox, 6 KATP channel subunits, and 12 metabolic genes. FoxF2, -O1, and -O3 strongly associate with expression of KATP channel subunits (in particular, KIR6.1, SUR1A and SUR2B) in different heart tissues and in the periinfarct zone of the left ventricle. Patch-clamp recordings demonstrate that molecular plasticity of these channels is matched by pharmacological plasticity and increased sensitivity to a metabolic challenge mimicked by the protonophore CCCP. A balance of FoxF2 and FoxO also regulates expression of at least 9 metabolic genes involved in setting the balance of glycolysis and beta-oxidation. Bioinformatics shows that the transcriptional mechanisms are highly conserved among chicken, mouse, rat, and human, and Fox are intimately linked to other metabolic sensors. Thus, FoxF2 and -O are key transcription factors coordinating expression of KATP channels and energy metabolism.",Circulation research,2008,Pierre Philip-Couderc,"Forkhead transcription factors coordinate expression of myocardial KATP channel subunits and energy metabolism. Coordinate adaptation of myocyte metabolism and function is fundamental to survival of the stressed heart, but the mechanisms for this coordination remain unclear. Bioinformatics led us to discover that Foxs are key transcription factors involved. We performed experiments on the mouse atrial cell line HL-1, neonate rat heart myocytes, and an adult rat model of myocardial infarction. In electrophoretic mobility-shift assays, FoxO1 binds to the FoxO concensus site of the KATP channel subunit KIR6.1 promoter. In primary atrial culture, targeting FoxO1 and FoxO3 with siRNA specifically reduces mRNA expression of FoxO1 and -O3 and KIR6.1. Western blots, confocal immunofluorescence, and quantitative RT-PCR was applied for measuring expression of 10 Fox, 6 KATP channel subunits, and 12 metabolic genes. FoxF2, -O1, and -O3 strongly associate with expression of KATP channel subunits (in particular, KIR6.1, SUR1A and SUR2B) in different heart tissues and in the periinfarct zone of the left ventricle. Patch-clamp recordings demonstrate that molecular plasticity of these channels is matched by pharmacological plasticity and increased sensitivity to a metabolic challenge mimicked by the protonophore CCCP. A balance of FoxF2 and FoxO also regulates expression of at least 9 metabolic genes involved in setting the balance of glycolysis and beta-oxidation. Bioinformatics shows that the transcriptional mechanisms are highly conserved among chicken, mouse, rat, and human, and Fox are intimately linked to other metabolic sensors. Thus, FoxF2 and -O are key transcription factors coordinating expression of KATP channels and energy metabolism.",1,0,0,,3,True
18498098,"Expression of FoxC, FoxF, FoxL1, and FoxQ1 genes in the dogfish Scyliorhinus canicula defines ancient and derived roles for Fox genes in vertebrate development.","In the human genome, members of the FoxC, FoxF, FoxL1, and FoxQ1 gene families are found in two paralagous clusters. Here we characterize all four gene families in the dogfish Scyliorhinus canicula, a member of the cartilaginous fish lineage that diverged before the radiation of osteichthyan vertebrates. We identify two FoxC genes, two FoxF genes, and single FoxQ1 and FoxL1 genes, demonstrating cluster duplication preceded the radiation of gnathostomes. The expression of all six genes was analyzed by in situ hybridization. The results show conserved expression of FoxL1, FoxF, and FoxC genes in different compartments of the mesoderm and of FoxQ1 in pharyngeal endoderm and its derivatives, confirming these as ancient sites of Fox gene expression, and also illustrate multiple cases of lineage-specific expression domains. Comparison to invertebrate chordates shows that the majority of conserved vertebrate expression domains mark tissues that are part of the primitive chordate body plan.",Developmental dynamics : an official publication of the American Association of Anatomists,2008,Karl R Wotton,"Expression of FoxC, FoxF, FoxL1, and FoxQ1 genes in the dogfish Scyliorhinus canicula defines ancient and derived roles for Fox genes in vertebrate development. In the human genome, members of the FoxC, FoxF, FoxL1, and FoxQ1 gene families are found in two paralagous clusters. Here we characterize all four gene families in the dogfish Scyliorhinus canicula, a member of the cartilaginous fish lineage that diverged before the radiation of osteichthyan vertebrates. We identify two FoxC genes, two FoxF genes, and single FoxQ1 and FoxL1 genes, demonstrating cluster duplication preceded the radiation of gnathostomes. The expression of all six genes was analyzed by in situ hybridization. The results show conserved expression of FoxL1, FoxF, and FoxC genes in different compartments of the mesoderm and of FoxQ1 in pharyngeal endoderm and its derivatives, confirming these as ancient sites of Fox gene expression, and also illustrate multiple cases of lineage-specific expression domains. Comparison to invertebrate chordates shows that the majority of conserved vertebrate expression domains mark tissues that are part of the primitive chordate body plan.",0,0,0,,0,False
18698484,"Hedgehog signaling, epithelial-to-mesenchymal transition and miRNA (review).","SHH, IHH, and DHH are lipid-modified secreted proteins binding to Patched receptors, and CDON, BOC or GAS1 co-receptors. In the absence of Hedgehog signaling, GLI1 is transcriptionally repressed, GLI2 is phosphorylated by GSK3 and CK1 for the FBXW11 (betaTRCP2)-mediated degradation, and GLI3 is processed to a cleaved repressor. In the presence of Hedgehog signaling, Smoothened is relieved from Patched-mediated suppression due to the Hedgehog-dependent internalization of Patched, which leads to MAP3K10 (MST) activation and SUFU inactivation for the stabilization and nuclear accumulation of GLI family members. GLI activators then upregulate CCND1, CCND2 for cell cycle acceleration, FOXA2, FOXC2, FOXE1, FOXF1, FOXL1, FOXP3, POU3F1, RUNX2, SOX13, TBX2 for cell fate determination, JAG2, INHBC, and INHBE for stem cell signaling regulation. Hedgehog signals also upregulate SFRP1 in mesenchymal cells for WNT signaling regulation. Epithelial-to-mesenchymal transition (EMT) during embryogenesis, adult tissue homeostasis and carcinogenesis is characterized by class switch from E-cadherin to N-cadherin. SNAI1 (Snail), SNAI2 (Slug), SNAI3, ZEB1, ZEB2 (SIP1), KLF8, TWIST1, and TWIST2 are EMT regulators repressing CDH1 gene encoding E-cadherin. Hedgehog signals induce JAG2 upregulation for Notch-CSL-mediated SNAI1 upregulation, and also induce TGFbeta1 secretion for ZEB1 and ZEB2 upregulation via TGFbeta receptor and NF-kappaB. TGFbeta-mediated downregulation of miR-141, miR-200a, miR-200b, miR-200c, miR-205, and miR-429 results in upregulation of ZEB1 and ZEB2 proteins. Hedgehog signaling activation indirectly leads to EMT through FGF, Notch, TGFbeta signaling cascades, and miRNA regulatory networks. miRNAs targeted to stem cell signaling components or EMT regulators are potent drug targets; however, off-target effects should be strictly controlled before clinical application of synthetic miRNA. Peptide mimetic and RNA aptamer could also be utilized as Hedgehog signaling inhibitors or EMT suppressors.",International journal of molecular medicine,2008,Yuriko Katoh,"Hedgehog signaling, epithelial-to-mesenchymal transition and miRNA (review). SHH, IHH, and DHH are lipid-modified secreted proteins binding to Patched receptors, and CDON, BOC or GAS1 co-receptors. In the absence of Hedgehog signaling, GLI1 is transcriptionally repressed, GLI2 is phosphorylated by GSK3 and CK1 for the FBXW11 (betaTRCP2)-mediated degradation, and GLI3 is processed to a cleaved repressor. In the presence of Hedgehog signaling, Smoothened is relieved from Patched-mediated suppression due to the Hedgehog-dependent internalization of Patched, which leads to MAP3K10 (MST) activation and SUFU inactivation for the stabilization and nuclear accumulation of GLI family members. GLI activators then upregulate CCND1, CCND2 for cell cycle acceleration, FOXA2, FOXC2, FOXE1, FOXF1, FOXL1, FOXP3, POU3F1, RUNX2, SOX13, TBX2 for cell fate determination, JAG2, INHBC, and INHBE for stem cell signaling regulation. Hedgehog signals also upregulate SFRP1 in mesenchymal cells for WNT signaling regulation. Epithelial-to-mesenchymal transition (EMT) during embryogenesis, adult tissue homeostasis and carcinogenesis is characterized by class switch from E-cadherin to N-cadherin. SNAI1 (Snail), SNAI2 (Slug), SNAI3, ZEB1, ZEB2 (SIP1), KLF8, TWIST1, and TWIST2 are EMT regulators repressing CDH1 gene encoding E-cadherin. Hedgehog signals induce JAG2 upregulation for Notch-CSL-mediated SNAI1 upregulation, and also induce TGFbeta1 secretion for ZEB1 and ZEB2 upregulation via TGFbeta receptor and NF-kappaB. TGFbeta-mediated downregulation of miR-141, miR-200a, miR-200b, miR-200c, miR-205, and miR-429 results in upregulation of ZEB1 and ZEB2 proteins. Hedgehog signaling activation indirectly leads to EMT through FGF, Notch, TGFbeta signaling cascades, and miRNA regulatory networks. miRNAs targeted to stem cell signaling components or EMT regulators are potent drug targets; however, off-target effects should be strictly controlled before clinical application of synthetic miRNA. Peptide mimetic and RNA aptamer could also be utilized as Hedgehog signaling inhibitors or EMT suppressors.",1,0,0,,3,True
