pmid,title,abstract,journal,year,authors,full_text,foxf1_mentions,disease_mentions,variant_mentions,variants_found,relevance_score,is_relevant
15533815,Sequence and expression of the rainbow trout winged helix/forkhead transcription factor FoxF1.,"FoxF1 is a member of the winged helix/forkhead transcription factor gene family. We have cloned the cDNA encoding a rainbow trout FoxF1 homologue, and examined its developmental gene expression pattern. By 7 days postfertilization (dpf at 14 degrees C), FoxF1 is expressed throughout the alimentary tract in the mesenchymal cells adjacent to the endodermal epithelium, with intense signals on the dorsal side of the oral cavity and in the primitive stomach. As ontogeny proceeds, expression is down-regulated in the oral cavity and esophagus, but persists in the pharynx, stomach, and intestine. Hybridization signals are also detected in the developing liver, and in the mesenchyme layer around the notochord. From 18dpf onwards, dramatic changes occur in gene expression in the branchial region. As the gill filaments elongate from the branchial arches, FoxF1 begins to be expressed along the central cell cord running through each gill filament, and then switches over its rod-like expression to a repetitive pattern, alternating on either side along the proximal part of the filament. A signal is further localized to the primitive pillar cells as they form gill lamellae. In addition to illustrating the conserved FoxF1 expression pattern in the developing digestive tract and liver, the results indicate a close association of FoxF1 with the formation of the fish gills.",Gene expression patterns : GEP,2005,Yoshie Hidaka,"Sequence and expression of the rainbow trout winged helix/forkhead transcription factor FoxF1. FoxF1 is a member of the winged helix/forkhead transcription factor gene family. We have cloned the cDNA encoding a rainbow trout FoxF1 homologue, and examined its developmental gene expression pattern. By 7 days postfertilization (dpf at 14 degrees C), FoxF1 is expressed throughout the alimentary tract in the mesenchymal cells adjacent to the endodermal epithelium, with intense signals on the dorsal side of the oral cavity and in the primitive stomach. As ontogeny proceeds, expression is down-regulated in the oral cavity and esophagus, but persists in the pharynx, stomach, and intestine. Hybridization signals are also detected in the developing liver, and in the mesenchyme layer around the notochord. From 18dpf onwards, dramatic changes occur in gene expression in the branchial region. As the gill filaments elongate from the branchial arches, FoxF1 begins to be expressed along the central cell cord running through each gill filament, and then switches over its rod-like expression to a repetitive pattern, alternating on either side along the proximal part of the filament. A signal is further localized to the primitive pillar cells as they form gill lamellae. In addition to illustrating the conserved FoxF1 expression pattern in the developing digestive tract and liver, the results indicate a close association of FoxF1 with the formation of the fish gills.",1,0,0,,3,True
15609719,[Multiple roles of forkhead genes in development and metabolism].,,"Tanpakushitsu kakusan koso. Protein, nucleic acid, enzyme",2005,Naoyuki Miura,[Multiple roles of forkhead genes in development and metabolism]. ,0,0,0,,0,False
15704124,Subtelomeric deletions of chromosome 6p: molecular and cytogenetic characterization of three new cases with phenotypic overlap with Ritscher-Schinzel (3C) syndrome.,"We have identified six children in three families with subtelomeric deletions of 6p25 and a recognizable phenotype consisting of ptosis, posterior embryotoxon, optic nerve abnormalities, mild glaucoma, Dandy-Walker malformation, hydrocephalus, atrial septal defect, patent ductus arteriosus, and mild mental retardation. There is considerable clinical overlap between these children and individuals with the Ritscher-Schinzel (or cranio-cerebello-cardiac (3C)) syndrome (OMIM #220210). Clinical features of 3C syndrome include craniofacial anomalies (macrocephaly, prominent forehead and occiput, foramina parietalia, hypertelorism, down-slanting palpebral fissures, ocular colobomas, depressed nasal bridge, narrow or cleft palate, and low-set ears), cerebellar malformations (variable manifestations of a Dandy-Walker malformation with moderate mental retardation), and cardiac defects (primarily septal defects). Since the original report, over 25 patients with 3C syndrome have been reported. Recessive inheritance has been postulated based on recurrence in siblings born to unaffected parents and parental consanguinity in two familial cases. Molecular and cytogenetic mapping of the 6p deletions in these three families with subtelomeric deletions of chromosome 6p have defined a 1.3 Mb minimally deleted critical region. To determine if 6p deletions are common in 3C syndrome, we analyzed seven unrelated individuals with 3C syndrome for deletions of this region. Three forkhead genes (FOXF1 and FOXQ1 from within the critical region, and FOXC1 proximal to this region) were evaluated as potential candidate disease genes for this disorder. No deletions or disease-causing mutations were identified.",American journal of medical genetics. Part A,2005,Cheryl Descipio,"Subtelomeric deletions of chromosome 6p: molecular and cytogenetic characterization of three new cases with phenotypic overlap with Ritscher-Schinzel (3C) syndrome. We have identified six children in three families with subtelomeric deletions of 6p25 and a recognizable phenotype consisting of ptosis, posterior embryotoxon, optic nerve abnormalities, mild glaucoma, Dandy-Walker malformation, hydrocephalus, atrial septal defect, patent ductus arteriosus, and mild mental retardation. There is considerable clinical overlap between these children and individuals with the Ritscher-Schinzel (or cranio-cerebello-cardiac (3C)) syndrome (OMIM #220210). Clinical features of 3C syndrome include craniofacial anomalies (macrocephaly, prominent forehead and occiput, foramina parietalia, hypertelorism, down-slanting palpebral fissures, ocular colobomas, depressed nasal bridge, narrow or cleft palate, and low-set ears), cerebellar malformations (variable manifestations of a Dandy-Walker malformation with moderate mental retardation), and cardiac defects (primarily septal defects). Since the original report, over 25 patients with 3C syndrome have been reported. Recessive inheritance has been postulated based on recurrence in siblings born to unaffected parents and parental consanguinity in two familial cases. Molecular and cytogenetic mapping of the 6p deletions in these three families with subtelomeric deletions of chromosome 6p have defined a 1.3 Mb minimally deleted critical region. To determine if 6p deletions are common in 3C syndrome, we analyzed seven unrelated individuals with 3C syndrome for deletions of this region. Three forkhead genes (FOXF1 and FOXQ1 from within the critical region, and FOXC1 proximal to this region) were evaluated as potential candidate disease genes for this disorder. No deletions or disease-causing mutations were identified.",1,4,2,6p25,13,True
15709204,Transcriptional profiling identifies gene expression changes associated with IFN-alpha tolerance in hepatitis C-related hepatocellular carcinoma cells.,,Clinical cancer research : an official journal of the American Association for Cancer Research,2005,Nathalie Wong,Transcriptional profiling identifies gene expression changes associated with IFN-alpha tolerance in hepatitis C-related hepatocellular carcinoma cells. ,0,0,0,,0,False
16144835,Functional characterization of evolutionarily conserved DNA regions in forkhead box f1 gene locus.,"The Forkhead Box f1 (Foxf1) transcription factor (previously known as HFH-8 or Freac-1) is expressed in the septum transversum and splanchnic (visceral) mesoderm and is required for proper development of gut-derived organs. Sequence comparisons of mouse and human Foxf1 genes have revealed highly conserved DNA sequences located within the -5.3-kb Foxf1 promoter region and the 400-nucleotide regulatory element located 1 kb 3' to the Foxf1 gene (3'RE). To examine their transcriptional activity during mouse embryonic development, we generated transgenic mice in which the expression of the beta-galactosidase transgene was controlled by the -2.7-kb Foxf1 promoter region, the -5.3-kb Foxf1 promoter region, or the -5.3-kb Foxf1 promoter region fused to the 3'RE. The -5.3-kb Foxf1 promoter sequences induced appropriate transgene expression in the midgut and developing intestine, whereas the -2.7-kb Foxf1 promoter region was transcriptionally inactive. Addition of 3'RE to the -5.3-kb Foxf1 promoter restored proper transgene expression in the foregut, liver, and lung mesenchyme and prevented ectopic transgene expression in the developing nervous system. Cotransfection studies demonstrated that FoxA2 protein bound to the 3'RE region (+4506/+4529 bp) and was sufficient to inhibit expression of the -5.3-kb Foxf1 promoter. Furthermore, C/EBPbeta and HNF-6 proteins bound to the 3'RE region (+4647/+4694 bp) and provided synergistic transcriptional activation of the -5.3-kb Foxf1 promoter in cotransfection assays. These studies demonstrated that the conserved Foxf1 3'RE region is essential for proper tissue-specific regulation of the Foxf1 promoter region during mouse embryogenesis.",The Journal of biological chemistry,2006,Il-Man Kim,"Functional characterization of evolutionarily conserved DNA regions in forkhead box f1 gene locus. The Forkhead Box f1 (Foxf1) transcription factor (previously known as HFH-8 or Freac-1) is expressed in the septum transversum and splanchnic (visceral) mesoderm and is required for proper development of gut-derived organs. Sequence comparisons of mouse and human Foxf1 genes have revealed highly conserved DNA sequences located within the -5.3-kb Foxf1 promoter region and the 400-nucleotide regulatory element located 1 kb 3' to the Foxf1 gene (3'RE). To examine their transcriptional activity during mouse embryonic development, we generated transgenic mice in which the expression of the beta-galactosidase transgene was controlled by the -2.7-kb Foxf1 promoter region, the -5.3-kb Foxf1 promoter region, or the -5.3-kb Foxf1 promoter region fused to the 3'RE. The -5.3-kb Foxf1 promoter sequences induced appropriate transgene expression in the midgut and developing intestine, whereas the -2.7-kb Foxf1 promoter region was transcriptionally inactive. Addition of 3'RE to the -5.3-kb Foxf1 promoter restored proper transgene expression in the foregut, liver, and lung mesenchyme and prevented ectopic transgene expression in the developing nervous system. Cotransfection studies demonstrated that FoxA2 protein bound to the 3'RE region (+4506/+4529 bp) and was sufficient to inhibit expression of the -5.3-kb Foxf1 promoter. Furthermore, C/EBPbeta and HNF-6 proteins bound to the 3'RE region (+4647/+4694 bp) and provided synergistic transcriptional activation of the -5.3-kb Foxf1 promoter in cotransfection assays. These studies demonstrated that the conserved Foxf1 3'RE region is essential for proper tissue-specific regulation of the Foxf1 promoter region during mouse embryogenesis.",2,0,0,,6,True
16368574,Micro-RNA-like effects of complete intronic sequences.,"MicroRNAs (miRNAs) have been suggested as suppressors of numerous target genes in human cells. In this report, we present gene chip array data indicating that in the absence of miRNA sequences, complete human introns are similarly capable of coordinating expression of large numbers of gene products at spatially diverse sites within the genome. The expression of selected intronic sequences (6a, 14b and 23) derived from the cystic fibrosis transmembrane conductance regulator (CFTR) gene caused extensive and specific transcriptional changes in epithelial cells (HeLa) that do not normally express this gene product. Each intron initiated a distinctive pattern of gene transcription. Affected genes such as FOXF1, sucrase-isomaltase, collagen, interferon, complement and thrombospondin 1 have previously been linked to CFTR function or are known to contribute to the related processes of epithelial differentiation and repair. A possible regulatory function of this nature has not been demonstrated previously for non-coding sequences within eukaryotic DNA. The results are consistent with the observation that splicesomal introns are found only in eukaryotic organisms and that the number of introns increases with phylogenetic complexity.",Frontiers in bioscience : a journal and virtual library,2006,Aubrey E Hill,"Micro-RNA-like effects of complete intronic sequences. MicroRNAs (miRNAs) have been suggested as suppressors of numerous target genes in human cells. In this report, we present gene chip array data indicating that in the absence of miRNA sequences, complete human introns are similarly capable of coordinating expression of large numbers of gene products at spatially diverse sites within the genome. The expression of selected intronic sequences (6a, 14b and 23) derived from the cystic fibrosis transmembrane conductance regulator (CFTR) gene caused extensive and specific transcriptional changes in epithelial cells (HeLa) that do not normally express this gene product. Each intron initiated a distinctive pattern of gene transcription. Affected genes such as FOXF1, sucrase-isomaltase, collagen, interferon, complement and thrombospondin 1 have previously been linked to CFTR function or are known to contribute to the related processes of epithelial differentiation and repair. A possible regulatory function of this nature has not been demonstrated previously for non-coding sequences within eukaryotic DNA. The results are consistent with the observation that splicesomal introns are found only in eukaryotic organisms and that the number of introns increases with phylogenetic complexity.",1,0,0,,3,True
16448649,Differential epithelial expression of SHH and FOXF1 in usual and nonspecific interstitial pneumonia.,"Morphogenetic factors have been shown to play a role in embryogenesis and post-embryonic disease. Interstitial pulmonary fibrosis is a chronic and often progressive disorder that can lead to end-stage cystic lung. Its two major subtypes, usual interstitial pneumonitis (UIP) and nonspecific interstitial pneumonitis (NSIP) differ in their response to immunosuppressive regimens, with UIP having a significantly worse prognosis. The clinical and histologic overlap between these disorders is substantial, and there are no ancillary findings that can accurately distinguish them. We examined surgical and autopsy specimens of lung in 13 cases of patients with either UIP or the fibrotic variant of NSIP (NSIP-F) for their expression of Sonic hedgehog (Shh) and Foxf1 in situ. We identified a pattern of strong Shh expression with weak expression of Foxf1 in all cases of UIP and a complementary expression of Shh and Foxf1 in cases of NSIP-F. We conclude that morphogenetic genes may participate differentially in the pathogenesis of UIP and NSIP-F.",Experimental and molecular pathology,2006,David R Coon,"Differential epithelial expression of SHH and FOXF1 in usual and nonspecific interstitial pneumonia. Morphogenetic factors have been shown to play a role in embryogenesis and post-embryonic disease. Interstitial pulmonary fibrosis is a chronic and often progressive disorder that can lead to end-stage cystic lung. Its two major subtypes, usual interstitial pneumonitis (UIP) and nonspecific interstitial pneumonitis (NSIP) differ in their response to immunosuppressive regimens, with UIP having a significantly worse prognosis. The clinical and histologic overlap between these disorders is substantial, and there are no ancillary findings that can accurately distinguish them. We examined surgical and autopsy specimens of lung in 13 cases of patients with either UIP or the fibrotic variant of NSIP (NSIP-F) for their expression of Sonic hedgehog (Shh) and Foxf1 in situ. We identified a pattern of strong Shh expression with weak expression of Foxf1 in all cases of UIP and a complementary expression of Shh and Foxf1 in cases of NSIP-F. We conclude that morphogenetic genes may participate differentially in the pathogenesis of UIP and NSIP-F.",2,2,1,,10,True
16772323,Transcription factor FOXF1 regulates growth hormone variant gene expression.,"Deletion analysis of the human growth hormone variant (GHV) promoter in transient transfection studies in BeWo choriocarcinoma and HepG2 cells indicated that the region extending from nt -158/+57 retained full transcriptional activity. DNase I footprint analysis of the fragment revealed a protected region at nt -82/-77, which is in a putative FOXF1/FOXF2 binding site. Supershift assays using an antiserum to human FOXF1 demonstrated that the protected region binds FOXF1. Overexpression of FOXF1 in BeWo and HepG2 cells induced the GHV promoter, whereas overexpression of FOXF2 was without effect. Mutagenesis of the FOXF1/FOXF2 site reduced basal promoter activity by 50-60% and markedly attenuated transactivation of the promoter by FOXF1. These studies indicate that FOXF1 induces GHV expression by interaction with a FOXF1/FOXF2 cis-element in the proximal promoter.",American journal of physiology. Endocrinology and metabolism,2006,Jefferson P Lomenick,"Transcription factor FOXF1 regulates growth hormone variant gene expression. Deletion analysis of the human growth hormone variant (GHV) promoter in transient transfection studies in BeWo choriocarcinoma and HepG2 cells indicated that the region extending from nt -158/+57 retained full transcriptional activity. DNase I footprint analysis of the fragment revealed a protected region at nt -82/-77, which is in a putative FOXF1/FOXF2 binding site. Supershift assays using an antiserum to human FOXF1 demonstrated that the protected region binds FOXF1. Overexpression of FOXF1 in BeWo and HepG2 cells induced the GHV promoter, whereas overexpression of FOXF2 was without effect. Mutagenesis of the FOXF1/FOXF2 site reduced basal promoter activity by 50-60% and markedly attenuated transactivation of the promoter by FOXF1. These studies indicate that FOXF1 induces GHV expression by interaction with a FOXF1/FOXF2 cis-element in the proximal promoter.",2,0,2,,10,True
17168675,Chemopreventive agents alters global gene expression pattern: predicting their mode of action and targets.,"Chemoprevention has the potential to be a major component of colon, breast, prostate and lung cancer control. Epidemiological, experimental, and clinical studies provide evidence that antioxidants, anti-inflammatory agents, n-3 polyunsaturated fatty acids and several other phytochemicals possess unique modes of action against cancer growth. However, the mode of action of several of these agents at the gene transcription level is not completely understood. Completion of the human genome sequence and the advent of DNA microarrays using cDNAs enhanced the detection and identification of hundreds of differentially expressed genes in response to anticancer drugs or chemopreventive agents. In this review, we are presenting an extensive analysis of the key findings from studies using potential chemopreventive agents on global gene expression patterns, which lead to the identification of cancer drug targets. The summary of the study reports discussed in this review explains the extent of gene alterations mediated by more than 20 compounds including antioxidants, fatty acids, NSAIDs, phytochemicals, retinoids, selenium, vitamins, aromatase inhibitor, lovastatin, oltipraz, salvicine, and zinc. The findings from these studies further reveal the utility of DNA microarray in characterizing and quantifying the differentially expressed genes that are possibly reprogrammed by the above agents against colon, breast, prostate, lung, liver, pancreatic and other cancer types. Phenolic antioxidant resveratrol found in berries and grapes inhibits the formation of prostate tumors by acting on the regulatory genes such as p53 while activating a cascade of genes involved in cell cycle and apoptosis including p300, Apaf-1, cdk inhibitor p21, p57 (KIP2), p53 induced Pig 7, Pig 8, Pig 10, cyclin D, DNA fragmentation factor 45. The group of genes significantly altered by selenium includes cyclin D1, cdk5, cdk4, cdk2, cdc25A and GADD 153. Vitamine D shows impact on p21(Waf1/Cip1) p27 cyclin B and cyclin A1. Genomic expression profile with vitamin D indicated differential expression of gene targets such as c-JUN, JUNB, JUND, FREAC-1/FoxF1, ZNF-44/KOX7, plectin, filamin, and keratin-13, involved in antiproliferative, differentiation pathways. The agent UBEIL has a remarkable effect on cyclin D1. Curcumin mediated NrF2 pathway significantly altered p21(Waf1/Cip1) levels. Aromatase inhibitors affected the expression of cyclin D1. Interestingly, few dietary compounds listed in this review also have effect on APC, cdk inhibitors p21(Waf1/Cip1) and p27. Tea polyphenol EGCG has a significant effect on TGF-beta expression, while several other earlier studies have shown its effect on cell cycle regulatory proteins. This review article reveals potential chemoprevention drug targets, which are mainly centered on cell cycle regulatory pathway genes in cancer.",Current cancer drug targets,2007,Bhagavathi A Narayanan,"Chemopreventive agents alters global gene expression pattern: predicting their mode of action and targets. Chemoprevention has the potential to be a major component of colon, breast, prostate and lung cancer control. Epidemiological, experimental, and clinical studies provide evidence that antioxidants, anti-inflammatory agents, n-3 polyunsaturated fatty acids and several other phytochemicals possess unique modes of action against cancer growth. However, the mode of action of several of these agents at the gene transcription level is not completely understood. Completion of the human genome sequence and the advent of DNA microarrays using cDNAs enhanced the detection and identification of hundreds of differentially expressed genes in response to anticancer drugs or chemopreventive agents. In this review, we are presenting an extensive analysis of the key findings from studies using potential chemopreventive agents on global gene expression patterns, which lead to the identification of cancer drug targets. The summary of the study reports discussed in this review explains the extent of gene alterations mediated by more than 20 compounds including antioxidants, fatty acids, NSAIDs, phytochemicals, retinoids, selenium, vitamins, aromatase inhibitor, lovastatin, oltipraz, salvicine, and zinc. The findings from these studies further reveal the utility of DNA microarray in characterizing and quantifying the differentially expressed genes that are possibly reprogrammed by the above agents against colon, breast, prostate, lung, liver, pancreatic and other cancer types. Phenolic antioxidant resveratrol found in berries and grapes inhibits the formation of prostate tumors by acting on the regulatory genes such as p53 while activating a cascade of genes involved in cell cycle and apoptosis including p300, Apaf-1, cdk inhibitor p21, p57 (KIP2), p53 induced Pig 7, Pig 8, Pig 10, cyclin D, DNA fragmentation factor 45. The group of genes significantly altered by selenium includes cyclin D1, cdk5, cdk4, cdk2, cdc25A and GADD 153. Vitamine D shows impact on p21(Waf1/Cip1) p27 cyclin B and cyclin A1. Genomic expression profile with vitamin D indicated differential expression of gene targets such as c-JUN, JUNB, JUND, FREAC-1/FoxF1, ZNF-44/KOX7, plectin, filamin, and keratin-13, involved in antiproliferative, differentiation pathways. The agent UBEIL has a remarkable effect on cyclin D1. Curcumin mediated NrF2 pathway significantly altered p21(Waf1/Cip1) levels. Aromatase inhibitors affected the expression of cyclin D1. Interestingly, few dietary compounds listed in this review also have effect on APC, cdk inhibitors p21(Waf1/Cip1) and p27. Tea polyphenol EGCG has a significant effect on TGF-beta expression, while several other earlier studies have shown its effect on cell cycle regulatory proteins. This review article reveals potential chemoprevention drug targets, which are mainly centered on cell cycle regulatory pathway genes in cancer.",1,0,0,,3,True
