pmid,title,abstract,journal,year,authors,full_text,foxf1_mentions,disease_mentions,variant_mentions,variants_found,relevance_score,is_relevant
10092306,Transcriptional regulation of pig lactase-phlorizin hydrolase: involvement of HNF-1 and FREACs.,,Gastroenterology,1999,N Spodsberg,Transcriptional regulation of pig lactase-phlorizin hydrolase: involvement of HNF-1 and FREACs. ,0,0,0,,0,False
11278651,"Cloning and characterization of LUN, a novel ring finger protein that is highly expressed in lung and specifically binds to a palindromic sequence.","We isolated cDNAs encoding a novel RING finger protein (LUN), the mRNAs of which were expressed at high levels in the lung. In situ hybridization revealed that LUN mRNAs were expressed in the alveolar epithelium of the lung. The LUN gene locus was assigned to chromosome 9p21, which contains candidate tumor suppressor genes associated with loss of heterozygosity in more than 86% of small cell lung cancers. We clarified that LUN is localized to the nucleus and reveals Zn(2+)-dependent DNA binding activity. The region from amino acids 51 to 374 of LUN is responsible for DNA binding. Furthermore, we identified a novel palindromic binding consensus (5'-TCCCAGCACTTTGGGA-3') for the LUN binding. Interestingly, this LUN binding palindromic sequence is found in the upstream transcriptional regulatory region of the E-cadherin gene and two intervening regions of the talin gene. Our results suggested that LUN might be an important trans-acting transcriptional regulator for lung cancer-associated genes including E-cadherin and talin genes.",The Journal of biological chemistry,2001,D Chu,"Cloning and characterization of LUN, a novel ring finger protein that is highly expressed in lung and specifically binds to a palindromic sequence. We isolated cDNAs encoding a novel RING finger protein (LUN), the mRNAs of which were expressed at high levels in the lung. In situ hybridization revealed that LUN mRNAs were expressed in the alveolar epithelium of the lung. The LUN gene locus was assigned to chromosome 9p21, which contains candidate tumor suppressor genes associated with loss of heterozygosity in more than 86% of small cell lung cancers. We clarified that LUN is localized to the nucleus and reveals Zn(2+)-dependent DNA binding activity. The region from amino acids 51 to 374 of LUN is responsible for DNA binding. Furthermore, we identified a novel palindromic binding consensus (5'-TCCCAGCACTTTGGGA-3') for the LUN binding. Interestingly, this LUN binding palindromic sequence is found in the upstream transcriptional regulatory region of the E-cadherin gene and two intervening regions of the talin gene. Our results suggested that LUN might be an important trans-acting transcriptional regulator for lung cancer-associated genes including E-cadherin and talin genes.",0,0,0,9p21,2,False
11313147,Structural characterization of the mouse Foxf1a gene.,"Members in the superfamily of the forkhead/winged-helix transcription factors are known to play a critical role in the control of cell differentiation and tissue development. To understand the regulation and function of these genes, we have initially isolated and characterized the mouse Foxf1a gene, a novel forkhead gene predominantly expressed in the lung. The mouse gene consists of two exons with the forkhead domain contained in exon 1, and is located at band E1 on chromosome 8. Amino acid sequence of the mouse protein shares a high degree of homology to that of the corresponding human protein. The tissue specificity of expression of the mouse gene also resembles that found in the human gene. This gene is primarily expressed in the lung, and to a lesser extent in placenta and tissues in gastrointestinal tract. The transcription start site was mapped to 113 nucleotides upstream from the putative translation initiation site. The promoter of the mouse gene is highly GC rich and contains neither a CAAT nor a TATA box. A series of luciferase report constructs driven by the promoter and various deletions in the 5' flanking region of the gene were constructed and employed in transient transfection studies using a line of SV40 transformed mouse lymph node endothelial cells (SVEC4-10), which express the endogenous Foxf1a gene, and a line of mouse hepatoma cells (Hepa 1-6), in which Foxf1a is not expressed. To our surprise, these reporter genes are equally active in both cell lines. Further studies have shown that the proximal 5' flanking sequence and exon 1 of the endogenous gene are highly methylated in Hepa 1-6 cells but not in SVEC4-10 cells, suggesting that DNA methylation but not cell-specific transcription factor(s) regulates cell specificity of gene expression in these cultured cells.",Gene,2001,V W Chang,"Structural characterization of the mouse Foxf1a gene. Members in the superfamily of the forkhead/winged-helix transcription factors are known to play a critical role in the control of cell differentiation and tissue development. To understand the regulation and function of these genes, we have initially isolated and characterized the mouse Foxf1a gene, a novel forkhead gene predominantly expressed in the lung. The mouse gene consists of two exons with the forkhead domain contained in exon 1, and is located at band E1 on chromosome 8. Amino acid sequence of the mouse protein shares a high degree of homology to that of the corresponding human protein. The tissue specificity of expression of the mouse gene also resembles that found in the human gene. This gene is primarily expressed in the lung, and to a lesser extent in placenta and tissues in gastrointestinal tract. The transcription start site was mapped to 113 nucleotides upstream from the putative translation initiation site. The promoter of the mouse gene is highly GC rich and contains neither a CAAT nor a TATA box. A series of luciferase report constructs driven by the promoter and various deletions in the 5' flanking region of the gene were constructed and employed in transient transfection studies using a line of SV40 transformed mouse lymph node endothelial cells (SVEC4-10), which express the endogenous Foxf1a gene, and a line of mouse hepatoma cells (Hepa 1-6), in which Foxf1a is not expressed. To our surprise, these reporter genes are equally active in both cell lines. Further studies have shown that the proximal 5' flanking sequence and exon 1 of the endogenous gene are highly methylated in Hepa 1-6 cells but not in SVEC4-10 cells, suggesting that DNA methylation but not cell-specific transcription factor(s) regulates cell specificity of gene expression in these cultured cells.",1,0,1,,5,True
11493558,"Haploinsufficiency of the forkhead gene Foxf1, a target for sonic hedgehog signaling, causes lung and foregut malformations.","The murine Foxf1 gene, encoding a forkhead - or winged helix - transcription factor, is expressed in splanchnic mesenchyme during organogenesis. The concentration of expression to subepithelial mesenchyme suggested that Foxf1 is activated by paracrine signals from endodermal epithelia. Homozygous Foxf1-null mice die before embryonic day 10, owing to defects in extra-embryonic mesoderm, and do not provide any information about the role of Foxf1 in morphogenesis of endodermally derived organs. We show that, on CD1 genetic background, Foxf1 heterozygote perinatal mortality is around 90%. The haploinsufficiency causes a variable phenotype that includes lung immaturity and hypoplasia, fusion of right lung lobes, narrowing of esophagus and trachea, esophageal atresia and tracheo-esophageal fistula. Similar malformations are observed in mutants that are defective in the sonic hedgehog (Shh) signaling pathway, and we show that exogenous Shh activates transcription of Foxf1 in developing lung. Foxf1 mRNA is absent in the lungs, foregut and sclerotomes of Shh(-/-) embryos, but persists in tissues where indian hedgehog (Ihh) is expressed. In lung organ cultures, activation of Foxf1 by Shh is counteracted by bone morphogenetic protein 4 (BMP4). Fibroblast growth factor (FGF) 10 and FGF7 both decrease Foxf1 expression and we speculate that this is mediated by transcriptional activation of epithelial Bmp4 (in the case of FGF10) and by inhibition of Shh expression for FGF7.","Development (Cambridge, England)",2001,M Mahlapuu,"Haploinsufficiency of the forkhead gene Foxf1, a target for sonic hedgehog signaling, causes lung and foregut malformations. The murine Foxf1 gene, encoding a forkhead - or winged helix - transcription factor, is expressed in splanchnic mesenchyme during organogenesis. The concentration of expression to subepithelial mesenchyme suggested that Foxf1 is activated by paracrine signals from endodermal epithelia. Homozygous Foxf1-null mice die before embryonic day 10, owing to defects in extra-embryonic mesoderm, and do not provide any information about the role of Foxf1 in morphogenesis of endodermally derived organs. We show that, on CD1 genetic background, Foxf1 heterozygote perinatal mortality is around 90%. The haploinsufficiency causes a variable phenotype that includes lung immaturity and hypoplasia, fusion of right lung lobes, narrowing of esophagus and trachea, esophageal atresia and tracheo-esophageal fistula. Similar malformations are observed in mutants that are defective in the sonic hedgehog (Shh) signaling pathway, and we show that exogenous Shh activates transcription of Foxf1 in developing lung. Foxf1 mRNA is absent in the lungs, foregut and sclerotomes of Shh(-/-) embryos, but persists in tissues where indian hedgehog (Ihh) is expressed. In lung organ cultures, activation of Foxf1 by Shh is counteracted by bone morphogenetic protein 4 (BMP4). Fibroblast growth factor (FGF) 10 and FGF7 both decrease Foxf1 expression and we speculate that this is mediated by transcriptional activation of epithelial Bmp4 (in the case of FGF10) and by inhibition of Shh expression for FGF7.",1,1,0,,4,True
11943666,Fusion of lung lobes and vessels in mouse embryos heterozygous for the forkhead box f1 targeted allele.,"Previously, we showed that newborn forkhead box (Fox)f1(+/-) mice with diminished pulmonary FoxF1 levels died of severe lung hemorrhage and exhibited abnormal formation of alveolar sacs and capillaries. Another group recently reported that Foxf1(+/-) mouse embryos displayed a number of organ and skeletal defects including fusion of lung lobes. However, identification of pulmonary genes whose altered expression was associated with the lobular fusion defect in Foxf1(+/-) lungs remains uncharacterized. The present study was conducted to determine the nature of the malformations leading to lung fusions in the FoxF1 embryos and to identify potential signaling pathways influenced by FoxF1 haploinsufficiency. We show that Foxf1(+/-) embryos exhibit defects in formation and branching of primary lung buds, which causes fusion of the right lung lobes and vessels. The severity of the Foxf1(+/-) lung fusions was correlated with decreased levels of FoxF1 mRNA. In situ hybridization studies demonstrated that the defective primary lung-bud development in early Foxf1(+/-) embryos was associated with fewer pulmonary mesenchymal-epithelial interfaces. Defects in branching morphogenesis in the Foxf1(+/-) embryos were associated with altered expression of the fibroblast growth factor-10, bone morphogenetic protein-4, and the Gli3 transcription factor, which are known to influence primary lung-bud development.",American journal of physiology. Lung cellular and molecular physiology,2002,Lorena Lim,"Fusion of lung lobes and vessels in mouse embryos heterozygous for the forkhead box f1 targeted allele. Previously, we showed that newborn forkhead box (Fox)f1(+/-) mice with diminished pulmonary FoxF1 levels died of severe lung hemorrhage and exhibited abnormal formation of alveolar sacs and capillaries. Another group recently reported that Foxf1(+/-) mouse embryos displayed a number of organ and skeletal defects including fusion of lung lobes. However, identification of pulmonary genes whose altered expression was associated with the lobular fusion defect in Foxf1(+/-) lungs remains uncharacterized. The present study was conducted to determine the nature of the malformations leading to lung fusions in the FoxF1 embryos and to identify potential signaling pathways influenced by FoxF1 haploinsufficiency. We show that Foxf1(+/-) embryos exhibit defects in formation and branching of primary lung buds, which causes fusion of the right lung lobes and vessels. The severity of the Foxf1(+/-) lung fusions was correlated with decreased levels of FoxF1 mRNA. In situ hybridization studies demonstrated that the defective primary lung-bud development in early Foxf1(+/-) embryos was associated with fewer pulmonary mesenchymal-epithelial interfaces. Defects in branching morphogenesis in the Foxf1(+/-) embryos were associated with altered expression of the fibroblast growth factor-10, bone morphogenetic protein-4, and the Gli3 transcription factor, which are known to influence primary lung-bud development.",3,1,0,,10,True
12221085,"IKKalpha, IKKbeta, and NEMO/IKKgamma are each required for the NF-kappa B-mediated inflammatory response program.","The IKKbeta and NEMO/IKKgamma subunits of the NF-kappaB-activating signalsome complex are known to be essential for activating NF-kappaB by inflammatory and other stress-like stimuli. However, the IKKalpha subunit is believed to be dispensable for the latter responses and instead functions as an in vivo mediator of other novel NF-kappaB-dependent and -independent functions. In contrast to this generally accepted view of IKKalpha's physiological functions, we demonstrate in mouse embryonic fibroblasts (MEFs) that, akin to IKKbeta and NEMO/IKKgamma, IKKalpha is also a global regulator of tumor necrosis factor alpha- and IL-1-responsive IKK signalsome-dependent target genes including many known NF-kappaB targets such as serum amyloid A3, C3, interleukin (IL)-6, IL-11, IL-1 receptor antagonist, vascular endothelial growth factor, Ptx3, beta(2)-microglobulin, IL-1alpha, Mcp-1 and -3, RANTES (regulated on activation normal T cell expressed and secreted), Fas antigen, Jun-B, c-Fos, macrophage colony-stimulating factor, and granulocyte-macrophage colony-stimulating factor. Only a small number of NF-kappaB-dependent target genes were preferentially dependent on IKKalpha or IKKbeta. Constitutive expression of a trans-dominant IkappaBalpha superrepressor (IkappaBalphaSR) in wild type MEFs confirmed that these signalsome-dependent target genes were also dependent on NF-kappaB. A subset of NF-kappaB target genes were IKK-dependent in the absence of exogenous stimuli, suggesting that the signalsome was also required to regulate basal levels of activated NF-kappaB in established MEFs. Overall, a sizable number of novel NF-kappaB/IKK-dependent genes were identified including Secreted Frizzled, cadherin 13, protocadherin 7, CCAAT/enhancer-binding protein-beta and -delta, osteoprotegerin, FOXC2 and FOXF2, BMP-2, p75 neurotrophin receptor, caspase-11, guanylate-binding proteins 1 and 2, ApoJ/clusterin, interferon (alpha and beta) receptor 2, decorin, osteoglycin, epiregulin, proliferins 2 and 3, stromal cell-derived factor, and cathepsins B, F, and Z. SOCS-3, a negative effector of STAT3 signaling, was found to be an NF-kappaB/IKK-induced gene, suggesting that IKK-mediated NF-kappaB activation can coordinately illicit negative effects on STAT signaling.",The Journal of biological chemistry,2003,Xiang Li,"IKKalpha, IKKbeta, and NEMO/IKKgamma are each required for the NF-kappa B-mediated inflammatory response program. The IKKbeta and NEMO/IKKgamma subunits of the NF-kappaB-activating signalsome complex are known to be essential for activating NF-kappaB by inflammatory and other stress-like stimuli. However, the IKKalpha subunit is believed to be dispensable for the latter responses and instead functions as an in vivo mediator of other novel NF-kappaB-dependent and -independent functions. In contrast to this generally accepted view of IKKalpha's physiological functions, we demonstrate in mouse embryonic fibroblasts (MEFs) that, akin to IKKbeta and NEMO/IKKgamma, IKKalpha is also a global regulator of tumor necrosis factor alpha- and IL-1-responsive IKK signalsome-dependent target genes including many known NF-kappaB targets such as serum amyloid A3, C3, interleukin (IL)-6, IL-11, IL-1 receptor antagonist, vascular endothelial growth factor, Ptx3, beta(2)-microglobulin, IL-1alpha, Mcp-1 and -3, RANTES (regulated on activation normal T cell expressed and secreted), Fas antigen, Jun-B, c-Fos, macrophage colony-stimulating factor, and granulocyte-macrophage colony-stimulating factor. Only a small number of NF-kappaB-dependent target genes were preferentially dependent on IKKalpha or IKKbeta. Constitutive expression of a trans-dominant IkappaBalpha superrepressor (IkappaBalphaSR) in wild type MEFs confirmed that these signalsome-dependent target genes were also dependent on NF-kappaB. A subset of NF-kappaB target genes were IKK-dependent in the absence of exogenous stimuli, suggesting that the signalsome was also required to regulate basal levels of activated NF-kappaB in established MEFs. Overall, a sizable number of novel NF-kappaB/IKK-dependent genes were identified including Secreted Frizzled, cadherin 13, protocadherin 7, CCAAT/enhancer-binding protein-beta and -delta, osteoprotegerin, FOXC2 and FOXF2, BMP-2, p75 neurotrophin receptor, caspase-11, guanylate-binding proteins 1 and 2, ApoJ/clusterin, interferon (alpha and beta) receptor 2, decorin, osteoglycin, epiregulin, proliferins 2 and 3, stromal cell-derived factor, and cathepsins B, F, and Z. SOCS-3, a negative effector of STAT3 signaling, was found to be an NF-kappaB/IKK-induced gene, suggesting that IKK-mediated NF-kappaB activation can coordinately illicit negative effects on STAT signaling.",3,0,0,,9,True
12447869,Expression profiling of liver cell lines expressing entire or parts of hepatitis C virus open reading frame.,"Although hepatitis C virus (HCV) is a causative agent of liver diseases, its mechanism of pathogenesis is still unclear, mainly because of the lack of adequate cell culture systems to support HCV infection and replication. In this report, we describe development and characterization of human hepatoma cell lines constitutively expressing entire (Hep394) or parts (Hep352, Hep3294) of the HCV open reading frame (ORF). The viral and cellular proteolytic machinery involved in the viral precursor processing was consistently functional, and processed HCV proteins were synthesized in these established cell lines. By using a cDNA microarray analysis coupled with semiquantitative reverse-transcription polymerase chain reaction (RT-PCR), we identified 12 genes up-regulated and 4 genes down-regulated in Hep394 cells. With regard to genes related to cell growth regulation, we found up-regulation of forkhead transcription factor FREAC-1, poly (A) binding protein PABP2, and Ras suppressor Rsu-1. Another category of changes in gene expression includes MHC antigens, which play an important role in the T-cell-mediated immune reaction in the liver. In conclusion, functional genomic approaches comparing expression among the different cell lines expressing parts of the HCV genome may promote our understanding of the molecular basis of pathogenicity of HCV infection.","Hepatology (Baltimore, Md.)",2003,Hideki Aizaki,"Expression profiling of liver cell lines expressing entire or parts of hepatitis C virus open reading frame. Although hepatitis C virus (HCV) is a causative agent of liver diseases, its mechanism of pathogenesis is still unclear, mainly because of the lack of adequate cell culture systems to support HCV infection and replication. In this report, we describe development and characterization of human hepatoma cell lines constitutively expressing entire (Hep394) or parts (Hep352, Hep3294) of the HCV open reading frame (ORF). The viral and cellular proteolytic machinery involved in the viral precursor processing was consistently functional, and processed HCV proteins were synthesized in these established cell lines. By using a cDNA microarray analysis coupled with semiquantitative reverse-transcription polymerase chain reaction (RT-PCR), we identified 12 genes up-regulated and 4 genes down-regulated in Hep394 cells. With regard to genes related to cell growth regulation, we found up-regulation of forkhead transcription factor FREAC-1, poly (A) binding protein PABP2, and Ras suppressor Rsu-1. Another category of changes in gene expression includes MHC antigens, which play an important role in the T-cell-mediated immune reaction in the liver. In conclusion, functional genomic approaches comparing expression among the different cell lines expressing parts of the HCV genome may promote our understanding of the molecular basis of pathogenicity of HCV infection.",0,1,0,,1,False
12761041,Gene expression differences in quiescent versus regenerating hair cells of avian sensory epithelia: implications for human hearing and balance disorders.,"The sensory receptors for hearing and balance are the hair cells of the cochlea and vestibular organs of the inner ear. Permanent hearing and balance deficits can be triggered by genetic susceptibilities or environmental factors such as infection. Unlike mammalian hair cells that have a limited capacity for regeneration, the vestibular organ of the avian ear is constantly undergoing hair cell regeneration, whereas the avian cochlea undergoes regeneration only when hair cells are damaged. In order to gain insights into the genetic programs that govern the regenerative capacity of hair cells, we interrogated custom human cDNA microarrays with sensory epithelial cell targets from avian inner ears. The arrays contained probes from conserved regions of approximately 400 genes expressed primarily in the inner ear and approximately 1500 transcription factors (TF). Highly significant differences were observed for 20 inner-ear genes and more than 80 TFs. Genes up-regulated in the cochlea included BMP4, GATA3, GSN, FOXF1 and PRDM7. Genes up-regulated in the utricle included SMAD2, KIT, beta-AMYLOID, LOC51637, HMG20B and CRIP2. Many of the highly significant changes were validated by Q-PCR and in situ methods. Some of the observed changes implicated a number of known biochemical pathways including the c-kit pathway previously observed in melanogenesis. Twenty differentially expressed TFs map to chromosomal regions harboring uncloned human deafness loci, and represent novel candidates for hearing loss. The approach described here also illustrates the power of utilizing conserved human cDNA probes for cross-species comparisons.",Human molecular genetics,2004,R David Hawkins,"Gene expression differences in quiescent versus regenerating hair cells of avian sensory epithelia: implications for human hearing and balance disorders. The sensory receptors for hearing and balance are the hair cells of the cochlea and vestibular organs of the inner ear. Permanent hearing and balance deficits can be triggered by genetic susceptibilities or environmental factors such as infection. Unlike mammalian hair cells that have a limited capacity for regeneration, the vestibular organ of the avian ear is constantly undergoing hair cell regeneration, whereas the avian cochlea undergoes regeneration only when hair cells are damaged. In order to gain insights into the genetic programs that govern the regenerative capacity of hair cells, we interrogated custom human cDNA microarrays with sensory epithelial cell targets from avian inner ears. The arrays contained probes from conserved regions of approximately 400 genes expressed primarily in the inner ear and approximately 1500 transcription factors (TF). Highly significant differences were observed for 20 inner-ear genes and more than 80 TFs. Genes up-regulated in the cochlea included BMP4, GATA3, GSN, FOXF1 and PRDM7. Genes up-regulated in the utricle included SMAD2, KIT, beta-AMYLOID, LOC51637, HMG20B and CRIP2. Many of the highly significant changes were validated by Q-PCR and in situ methods. Some of the observed changes implicated a number of known biochemical pathways including the c-kit pathway previously observed in melanogenesis. Twenty differentially expressed TFs map to chromosomal regions harboring uncloned human deafness loci, and represent novel candidates for hearing loss. The approach described here also illustrates the power of utilizing conserved human cDNA probes for cross-species comparisons.",1,1,0,,4,True
